school_name,school_type,state,city,programs_offered,total_enrollment,veteran_enrollment,yellow_ribbon_program,in_state_tuition,out_of_state_tuition,housing_allowance_rate,graduation_rate,veteran_graduation_rate,post_graduation_employment_rate,gi_bill_students,veteran_services_office,contact_phone,contact_email,website,notes
Broward College,Community College,Florida,Fort Lauderdale,"Business, Technology, Healthcare",65000,1200,Yes,"$2,900","$11,200","$1,779",38%,48%,70%,1200,(954) 201-7350,veterans@broward.edu,https://www.broward.edu,"Multiple campuses, strong veteran support"
Valencia College,Community College,Florida,Orlando,"Liberal Arts, Healthcare, Technology",72000,1400,Yes,"$2,800","$10,800","$1,779",45%,54%,75%,1400,(407) 582-1507,veterans@valenciacollege.edu,https://www.valenciacollege.edu,"Disney partnership, hospitality programs"
Palm Beach State College,Community College,Florida,Lake Worth,"Business, Healthcare, Technology",48000,950,Yes,"$2,900","$11,100","$1,779",40%,50%,72%,950,(561) 967-7222,veteranservices@palmbeachstate.edu,https://www.palmbeachstate.edu,"Multiple campuses, comprehensive programs"
Hillsborough Community College,Community College,Florida,Tampa,"Liberal Arts, Healthcare, Technology",45000,850,Yes,"$2,800","$10,600","$1,779",42%,52%,74%,850,(813) 253-7000,veterans@hccfl.edu,https://www.hccfl.edu,"Near MacDill AFB, military-friendly"
St. Petersburg College,Community College,Florida,St. Petersburg,"Business, Technology, Healthcare",32000,680,Yes,"$2,900","$11,000","$1,779",48%,56%,78%,680,(727) 341-4772,veterans@spcollege.edu,https://www.spcollege.edu,"Waterfront campus, strong academics"
Seminole State College,Community College,Florida,Sanford,"Liberal Arts, Healthcare, Technology",18000,380,Yes,"$2,800","$10,700","$1,779",44%,52%,73%,380,(407) 708-2050,veterans@seminolestate.edu,https://www.seminolestate.edu,"Multiple campuses, transfer programs"
Polk State College,Community College,Florida,Winter Haven,"Business, Healthcare, Technology",12000,280,Yes,"$2,900","$11,200","$1,779",40%,48%,70%,280,(863) 297-1000,veterans@polk.edu,https://www.polk.edu,"Central Florida location"
Indian River State College,Community College,Florida,Fort Pierce,"Liberal Arts, Healthcare, Technology",16000,340,Yes,"$2,800","$10,900","$1,779",46%,54%,75%,340,(772) 462-4772,veterans@irsc.edu,https://www.irsc.edu,"Multiple campuses, strong programs"
Central Georgia Technical College,Technical College,Georgia,Macon,"Technology, Healthcare, Business",8500,195,Yes,"$2,600","$7,800","$1,476",55%,62%,82%,195,(478) 757-3400,veterans@centralgatech.edu,https://www.centralgatech.edu,"Technical focus, job placement"
Savannah Technical College,Technical College,Georgia,Savannah,"Technology, Healthcare, Business",4200,105,Yes,"$2,600","$7,800","$1,476",58%,65%,85%,105,(912) 443-5700,veterans@savannahtech.edu,https://www.savannahtech.edu,"Port city location, logistics programs"
Albany Technical College,Technical College,Georgia,Albany,"Technology, Healthcare, Business",3800,90,Yes,"$2,600","$7,800","$1,476",52%,60%,80%,90,(229) 430-3500,veterans@albanytech.edu,https://www.albanytech.edu,"Southwest Georgia, technical training"
Augusta Technical College,Technical College,Georgia,Augusta,"Technology, Healthcare, Business",4500,115,Yes,"$2,600","$7,800","$1,476",56%,63%,83%,115,(706) 771-4000,veterans@augustatech.edu,https://www.augustatech.edu,"Near Fort Gordon, cybersecurity programs"
Kapiolani Community College,Community College,Hawaii,Honolulu,"Liberal Arts, Healthcare, Culinary Arts",7500,280,Yes,"$3,500","$10,200","$2,571",42%,52%,70%,280,(808) 734-9000,veterans@hawaii.edu,https://www.kapiolani.hawaii.edu,"Diamond Head location, culinary programs"
Leeward Community College,Community College,Hawaii,Pearl City,"Liberal Arts, Technology, Business",6200,240,Yes,"$3,500","$10,200","$2,571",40%,50%,68%,240,(808) 455-0011,veterans@hawaii.edu,https://www.leeward.hawaii.edu,"Near Pearl Harbor, military-friendly"
College of Southern Idaho,Community College,Idaho,Twin Falls,"Liberal Arts, Agriculture, Technology",8500,185,Yes,"$4,000","$11,500","$1,386",45%,52%,72%,185,(208) 733-9554,veterans@csi.edu,https://www.csi.edu,"Agriculture programs, rural setting"
North Idaho College,Community College,Idaho,Coeur d'Alene,"Liberal Arts, Technology, Healthcare",5200,125,Yes,"$4,100","$12,000","$1,386",48%,55%,75%,125,(208) 769-3300,veterans@nic.edu,https://www.nic.edu,"Lake Coeur d'Alene location, outdoor programs"
College of DuPage,Community College,Illinois,Glen Ellyn,"Liberal Arts, Healthcare, Technology",28000,520,Yes,"$4,600","$12,800","$1,611",42%,50%,72%,520,(630) 942-2800,veterans@cod.edu,https://www.cod.edu,"Largest community college in Illinois"
Harper College,Community College,Illinois,Palatine,"Business, Healthcare, Technology",14000,285,Yes,"$4,800","$13,200","$1,611",48%,56%,75%,285,(847) 925-6000,veterans@harpercollege.edu,https://www.harpercollege.edu,"Northwest suburbs, strong programs"
Triton College,Community College,Illinois,River Grove,"Liberal Arts, Technology, Healthcare",12000,265,Yes,"$4,500","$12,600","$1,611",38%,46%,68%,265,(708) 456-0300,veterans@triton.edu,https://www.triton.edu,"Chicago suburbs, diverse programs"
Moraine Valley Community College,Community College,Illinois,Palos Hills,"Business, Healthcare, Technology",15000,310,Yes,"$4,700","$13,000","$1,611",44%,52%,74%,310,(708) 974-4300,veterans@morainevalley.edu,https://www.morainevalley.edu,"Southwest suburbs, comprehensive programs"
Oakton Community College,Community College,Illinois,Des Plaines,"Liberal Arts, Healthcare, Technology",10000,220,Yes,"$4,800","$13,400","$1,611",46%,54%,76%,220,(847) 635-1600,veterans@oakton.edu,https://www.oakton.edu,"Two campuses, transfer focus"
Elgin Community College,Community College,Illinois,Elgin,"Business, Technology, Healthcare",11000,240,Yes,"$4,600","$12,900","$1,611",42%,50%,72%,240,(847) 697-1000,veterans@elgin.edu,https://www.elgin.edu,"Fox Valley area, strong programs"
Joliet Junior College,Community College,Illinois,Joliet,"Liberal Arts, Healthcare, Technology",13000,280,Yes,"$4,500","$12,700","$1,611",40%,48%,70%,280,(815) 729-9020,veterans@jjc.edu,https://www.jjc.edu,"Southwest of Chicago, comprehensive"
Ivy Tech Community College,Community College,Indiana,Indianapolis,"Business, Healthcare, Technology",95000,1850,Yes,"$4,200","$8,900","$1,089",28%,38%,65%,1850,(888) 489-5463,veterans@ivytech.edu,https://www.ivytech.edu,"Statewide system, largest in Indiana"
Vincennes University,Community College,Indiana,Vincennes,"Liberal Arts, Technology, Aviation",5800,145,Yes,"$5,800","$15,200","$1,089",45%,52%,72%,145,(812) 888-4313,veterans@vinu.edu,https://www.vinu.edu,"Oldest college in Indiana, aviation programs"
Des Moines Area Community College,Community College,Iowa,Ankeny,"Business, Healthcare, Technology",22000,420,Yes,"$4,500","$9,200","$1,089",42%,50%,72%,420,(515) 964-6241,veterans@dmacc.edu,https://www.dmacc.edu,"Multiple campuses, comprehensive programs"
Kirkwood Community College,Community College,Iowa,Cedar Rapids,"Liberal Arts, Healthcare, Technology",16000,340,Yes,"$4,600","$9,400","$1,089",48%,56%,75%,340,(319) 398-5411,veterans@kirkwood.edu,https://www.kirkwood.edu,"Eastern Iowa, strong programs"
Indian Hills Community College,Community College,Iowa,Ottumwa,"Business, Technology, Healthcare",4200,95,Yes,"$4,400","$9,000","$1,089",44%,52%,73%,95,(641) 683-5111,veterans@indianhills.edu,https://www.indianhills.edu,"Rural location, affordable"
Johnson County Community College,Community College,Kansas,Overland Park,"Liberal Arts, Healthcare, Technology",18000,380,Yes,"$2,700","$6,900","$1,089",48%,56%,75%,380,(913) 469-8500,veterans@jccc.edu,https://www.jccc.edu,"Kansas City metro, comprehensive"
Wichita Area Technical College,Technical College,Kansas,Wichita,"Technology, Healthcare, Aviation",1800,55,Yes,"$3,200","$7,800","$1,089",68%,75%,88%,55,(316) 677-9400,veterans@watc.edu,https://www.watc.edu,"Aviation capital, technical programs"
Bluegrass Community and Technical College,Community College,Kentucky,Lexington,"Business, Healthcare, Technology",12000,265,Yes,"$4,500","$16,500","$1,089",38%,46%,68%,265,(859) 246-6200,veterans@bluegrass.kctcs.edu,https://www.bluegrass.kctcs.edu,"Central Kentucky, strong programs"
Jefferson Community and Technical College,Community College,Kentucky,Louisville,"Liberal Arts, Healthcare, Technology",14000,310,Yes,"$4,600","$16,800","$1,089",42%,50%,72%,310,(502) 213-4000,veterans@jefferson.kctcs.edu,https://www.jefferson.kctcs.edu,"Louisville area, comprehensive"
Delgado Community College,Community College,Louisiana,New Orleans,"Liberal Arts, Healthcare, Technology",18000,420,Yes,"$3,500","$7,800","$1,278",32%,42%,65%,420,(504) 671-5000,veterans@dcc.edu,https://www.dcc.edu,"New Orleans, maritime programs"
Baton Rouge Community College,Community College,Louisiana,Baton Rouge,"Business, Technology, Healthcare",8500,195,Yes,"$3,600","$8,200","$1,278",35%,45%,68%,195,(225) 216-8000,veterans@mybrcc.edu,https://www.mybrcc.edu,"State capital, growing campus"
SOWELA Technical Community College,Community College,Louisiana,Lake Charles,"Technology, Healthcare, Industrial",3200,85,Yes,"$3,400","$7,600","$1,278",48%,56%,78%,85,(337) 421-6565,veterans@sowela.edu,https://www.sowela.edu,"Industrial programs, petrochemical"
Southern Maine Community College,Community College,Maine,South Portland,"Liberal Arts, Maritime, Technology",6500,155,Yes,"$3,500","$7,800","$1,485",44%,52%,72%,155,(207) 741-5500,veterans@smccme.edu,https://www.smccme.edu,"Coastal location, maritime programs"
Central Maine Community College,Community College,Maine,Auburn,"Technology, Healthcare, Business",3200,82,Yes,"$3,400","$7,600","$1,485",48%,56%,75%,82,(207) 755-5100,veterans@cmcc.edu,https://www.cmcc.edu,"Central Maine, technical focus"
Montgomery College,Community College,Maryland,Rockville,"Liberal Arts, Healthcare, Technology",60000,1100,Yes,"$4,800","$11,500","$2,181",38%,48%,70%,1100,(240) 567-5000,veterans@montgomerycollege.edu,https://www.montgomerycollege.edu,"Three campuses, DC metro area"
Prince George's Community College,Community College,Maryland,Largo,"Business, Healthcare, Technology",13000,310,Yes,"$4,600","$11,200","$2,181",32%,42%,65%,310,(301) 336-6000,veterans@pgcc.edu,https://www.pgcc.edu,"Near DC, diverse student body"
Anne Arundel Community College,Community College,Maryland,Arnold,"Liberal Arts, Healthcare, Technology",13500,320,Yes,"$4,700","$11,400","$2,181",42%,52%,72%,320,(410) 647-7100,veterans@aacc.edu,https://www.aacc.edu,"Near Annapolis, strong programs"
Howard Community College,Community College,Maryland,Columbia,"Business, Technology, Healthcare",9800,225,Yes,"$4,900","$11,800","$2,181",48%,56%,78%,225,(443) 518-1000,veterans@howardcc.edu,https://www.howardcc.edu,"Between Baltimore and DC"
Bunker Hill Community College,Community College,Massachusetts,Boston,"Liberal Arts, Healthcare, Technology",13000,285,Yes,"$5,800","$11,900","$2,613",28%,38%,62%,285,(617) 228-2000,veterans@bhcc.edu,https://www.bhcc.edu,"Urban campus, diverse programs"
MassBay Community College,Community College,Massachusetts,Wellesley,"Business, Technology, Healthcare",5200,125,Yes,"$5,600","$11,500","$2,613",42%,50%,72%,125,(781) 239-3000,veterans@massbay.edu,https://www.massbay.edu,"West of Boston, strong academics"
Northern Essex Community College,Community College,Massachusetts,Haverhill,"Liberal Arts, Healthcare, Technology",7000,165,Yes,"$5,500","$11,400","$2,613",38%,46%,68%,165,(978) 556-3000,veterans@necc.mass.edu,https://www.necc.mass.edu,"Merrimack Valley, two campuses"
Middlesex Community College,Community College,Massachusetts,Bedford,"Business, Healthcare, Technology",9500,220,Yes,"$5,700","$11,700","$2,613",36%,44%,66%,220,(781) 280-3200,veterans@middlesex.mass.edu,https://www.middlesex.mass.edu,"Multiple campuses, comprehensive"
Grand Rapids Community College,Community College,Michigan,Grand Rapids,"Liberal Arts, Healthcare, Technology",16000,350,Yes,"$3,600","$7,200","$1,089",42%,50%,72%,350,(616) 234-4000,veterans@grcc.edu,https://www.grcc.edu,"West Michigan, strong programs"
Lansing Community College,Community College,Michigan,Lansing,"Business, Technology, Healthcare",18000,395,Yes,"$3,500","$7,000","$1,089",38%,46%,68%,395,(517) 483-1957,veterans@lcc.edu,https://www.lcc.edu,"State capital, comprehensive"
Macomb Community College,Community College,Michigan,Warren,"Liberal Arts, Healthcare, Technology",38000,780,Yes,"$3,400","$6,800","$1,089",36%,44%,66%,780,(586) 445-7999,veterans@macomb.edu,https://www.macomb.edu,"Detroit suburbs, large system"
Oakland Community College,Community College,Michigan,Bloomfield Hills,"Business, Technology, Healthcare",23000,505,Yes,"$3,500","$7,100","$1,089",32%,42%,64%,505,(248) 341-2000,veterans@oaklandcc.edu,https://www.oaklandcc.edu,"Multiple campuses, comprehensive"
Washtenaw Community College,Community College,Michigan,Ann Arbor,"Liberal Arts, Healthcare, Technology",12000,265,Yes,"$3,700","$7,400","$1,089",44%,52%,74%,265,(734) 973-3300,veterans@wccnet.edu,https://www.wccnet.edu,"Ann Arbor area, strong academics"
Mott Community College,Community College,Michigan,Flint,"Business, Technology, Healthcare",9500,215,Yes,"$3,600","$7,200","$1,089",35%,45%,67%,215,(810) 762-0200,veterans@mcc.edu,https://www.mcc.edu,"Flint area, comprehensive programs"
Minneapolis Community and Technical College,Community College,Minnesota,Minneapolis,"Liberal Arts, Healthcare, Technology",10000,235,Yes,"$5,400","$10,400","$1,287",35%,45%,68%,235,(612) 659-6000,veterans@minneapolis.edu,https://www.minneapolis.edu,"Urban campus, diverse programs"
Normandale Community College,Community College,Minnesota,Bloomington,"Business, Technology, Healthcare",9800,225,Yes,"$5,500","$10,600","$1,287",48%,56%,75%,225,(952) 358-8200,veterans@normandale.edu,https://www.normandale.edu,"Suburban Minneapolis, strong transfer"
Saint Paul College,Community College,Minnesota,St. Paul,"Technology, Healthcare, Business",6500,155,Yes,"$5,300","$10,200","$1,287",38%,46%,70%,155,(651) 846-1600,veterans@saintpaul.edu,https://www.saintpaul.edu,"State capital, technical programs"
Anoka-Ramsey Community College,Community College,Minnesota,Coon Rapids,"Liberal Arts, Healthcare, Technology",8500,195,Yes,"$5,400","$10,500","$1,287",44%,52%,73%,195,(763) 433-1100,veterans@anokaramsey.edu,https://www.anokaramsey.edu,"North metro, two campuses"
Hinds Community College,Community College,Mississippi,Raymond,"Liberal Arts, Healthcare, Technology",11000,265,Yes,"$2,800","$5,600","$891",38%,46%,68%,265,(601) 857-5261,veterans@hindscc.edu,https://www.hindscc.edu,"Multiple campuses statewide"
Mississippi Gulf Coast Community College,Community College,Mississippi,Perkinston,"Liberal Arts, Maritime, Technology",9500,235,Yes,"$2,900","$5,800","$891",42%,50%,72%,235,(601) 928-6211,veterans@mgccc.edu,https://www.mgccc.edu,"Coast location, maritime programs"
St. Louis Community College,Community College,Missouri,St. Louis,"Liberal Arts, Healthcare, Technology",24000,520,Yes,"$3,200","$5,100","$1,089",38%,46%,68%,520,(314) 644-9100,veterans@stlcc.edu,https://www.stlcc.edu,"Multiple campuses, comprehensive"
Metropolitan Community College,Community College,Missouri,Kansas City,"Business, Technology, Healthcare",18000,395,Yes,"$3,100","$4,800","$1,089",35%,44%,66%,395,(816) 604-1000,veterans@mcckc.edu,https://www.mcckc.edu,"Kansas City metro, multiple campuses"
State Fair Community College,Community College,Missouri,Sedalia,"Liberal Arts, Technology, Agriculture",4800,115,Yes,"$3,000","$4,600","$1,089",44%,52%,72%,115,(660) 530-5800,veterans@sfccmo.edu,https://www.sfccmo.edu,"Central Missouri, agriculture programs"
Montana State University-Northern,Public University,Montana,Havre,"Engineering, Education, Nursing",1200,35,Yes,"$5,500","$18,200","$990",32%,42%,68%,35,(406) 265-3700,veterans@msun.edu,https://www.msun.edu,"Rural Montana, technical programs"
Flathead Valley Community College,Community College,Montana,Kalispell,"Liberal Arts, Technology, Healthcare",2200,58,Yes,"$3,800","$10,200","$990",42%,50%,72%,58,(406) 756-3822,veterans@fvcc.edu,https://www.fvcc.edu,"Near Glacier Park, outdoor programs"
Metropolitan Community College,Community College,Nebraska,Omaha,"Business, Healthcare, Technology",16000,350,Yes,"$2,800","$4,200","$1,089",38%,46%,68%,350,(402) 457-2400,veterans@mccneb.edu,https://www.mccneb.edu,"Omaha metro, multiple campuses"
Southeast Community College,Community College,Nebraska,Lincoln,"Technology, Healthcare, Business",10000,235,Yes,"$2,900","$4,400","$1,089",52%,60%,78%,235,(402) 471-3333,veterans@southeast.edu,https://www.southeast.edu,"Multiple campuses, technical focus"
College of Southern Nevada,Community College,Nevada,Las Vegas,"Liberal Arts, Hospitality, Healthcare",37000,780,Yes,"$3,000","$10,500","$1,683",28%,38%,62%,780,(702) 651-5610,veterans@csn.edu,https://www.csn.edu,"Largest in Nevada, hospitality programs"
Truckee Meadows Community College,Community College,Nevada,Reno,"Liberal Arts, Technology, Healthcare",11000,255,Yes,"$3,100","$10,800","$1,485",36%,45%,68%,255,(775) 673-7000,veterans@tmcc.edu,https://www.tmcc.edu,"Reno area, comprehensive programs"
NHTI-Concord's Community College,Community College,New Hampshire,Concord,"Liberal Arts, Technology, Healthcare",4200,105,Yes,"$6,500","$14,800","$1,485",42%,50%,72%,105,(603) 271-6484,veterans@ccsnh.edu,https://www.nhti.edu,"State capital, technical programs"
Manchester Community College,Community College,New Hampshire,Manchester,"Business, Healthcare, Technology",3200,85,Yes,"$6,600","$15,200","$1,485",38%,46%,68%,85,(603) 206-8000,veterans@ccsnh.edu,https://www.mccnh.edu,"Largest city in NH"
Bergen Community College,Community College,New Jersey,Paramus,"Liberal Arts, Healthcare, Technology",14000,310,Yes,"$4,800","$9,600","$2,181",38%,46%,68%,310,(201) 447-7100,veterans@bergen.edu,https://www.bergen.edu,"Northern NJ, comprehensive"
Middlesex County College,Community College,New Jersey,Edison,"Business, Technology, Healthcare",12000,275,Yes,"$4,600","$9,200","$2,181",42%,50%,72%,275,(732) 548-6000,veterans@middlesexcc.edu,https://www.middlesexcc.edu,"Central NJ, strong programs"
Camden County College,Community College,New Jersey,Blackwood,"Liberal Arts, Healthcare, Technology",9500,220,Yes,"$4,500","$9,000","$2,181",36%,44%,66%,220,(856) 227-7200,veterans@camdencc.edu,https://www.camdencc.edu,"South Jersey, comprehensive"
Passaic County Community College,Community College,New Jersey,Paterson,"Business, Technology, Healthcare",8800,205,Yes,"$4,700","$9,400","$2,181",32%,42%,64%,205,(973) 684-6868,veterans@pccc.edu,https://www.pccc.edu,"North Jersey, diverse programs"
Central New Mexico Community College,Community College,New Mexico,Albuquerque,"Liberal Arts, Healthcare, Technology",23000,520,Yes,"$1,500","$7,200","$1,188",32%,42%,65%,520,(505) 224-3000,veterans@cnm.edu,https://www.cnm.edu,"Largest in NM, affordable"
Santa Fe Community College,Community College,New Mexico,Santa Fe,"Liberal Arts, Arts, Technology",4500,115,Yes,"$1,600","$2,500","$1,188",38%,46%,68%,115,(505) 428-1000,veterans@sfcc.edu,https://www.sfcc.edu,"State capital, arts programs"
Monroe Community College,Community College,New York,Rochester,"Liberal Arts, Healthcare, Technology",15000,340,Yes,"$5,100","$9,700","$1,836",38%,46%,68%,340,(585) 292-2000,veterans@monroecc.edu,https://www.monroecc.edu,"Rochester area, comprehensive"
Erie Community College,Community College,New York,Buffalo,"Business, Technology, Healthcare",11000,265,Yes,"$5,200","$10,200","$1,836",35%,44%,66%,265,(716) 851-1001,veterans@ecc.edu,https://www.ecc.edu,"Buffalo area, multiple campuses"
Onondaga Community College,Community College,New York,Syracuse,"Liberal Arts, Healthcare, Technology",9500,225,Yes,"$5,000","$9,500","$1,836",42%,50%,72%,225,(315) 498-2622,veterans@sunyocc.edu,https://www.sunyocc.edu,"Central NY, strong programs"
Suffolk County Community College,Community College,New York,Selden,"Liberal Arts, Healthcare, Technology",24000,550,Yes,"$5,300","$10,600","$2,613",32%,42%,64%,550,(631) 451-4110,veterans@sunysuffolk.edu,https://www.sunysuffolk.edu,"Long Island, three campuses"
Westchester Community College,Community College,New York,Valhalla,"Business, Technology, Healthcare",12000,285,Yes,"$5,400","$11,200","$2,613",38%,46%,68%,285,(914) 606-6600,veterans@sunywcc.edu,https://www.sunywcc.edu,"Westchester County, comprehensive"
Rockland Community College,Community College,New York,Suffern,"Liberal Arts, Healthcare, Technology",6500,155,Yes,"$5,200","$10,400","$2,613",36%,44%,66%,155,(845) 574-4000,veterans@sunyrockland.edu,https://www.sunyrockland.edu,"Hudson Valley, strong programs"
Wake Technical Community College,Community College,North Carolina,Raleigh,"Technology, Healthcare, Business",73000,1580,Yes,"$2,600","$8,900","$1,386",42%,52%,74%,1580,(919) 866-5000,veterans@waketech.edu,https://www.waketech.edu,"Research Triangle, largest in NC"
Central Piedmont Community College,Community College,North Carolina,Charlotte,"Liberal Arts, Healthcare, Technology",40000,850,Yes,"$2,500","$8,700","$1,386",38%,48%,70%,850,(704) 330-2722,veterans@cpcc.edu,https://www.cpcc.edu,"Charlotte metro, comprehensive"
Guilford Technical Community College,Community College,North Carolina,Jamestown,"Business, Technology, Healthcare",12000,285,Yes,"$2,600","$8,800","$1,386",36%,46%,68%,285,(336) 334-4822,veterans@gtcc.edu,https://www.gtcc.edu,"Greensboro area, strong programs"
Bismarck State College,Community College,North Dakota,Bismarck,"Technology, Energy, Liberal Arts",4200,105,Yes,"$4,400","$10,900","$990",48%,56%,75%,105,(701) 224-5400,veterans@bismarckstate.edu,https://www.bismarckstate.edu,"State capital, energy programs"
Cuyahoga Community College,Community College,Ohio,Cleveland,"Liberal Arts, Healthcare, Technology",20000,465,Yes,"$3,800","$7,300","$1,089",32%,42%,64%,465,(216) 987-6000,veterans@tri-c.edu,https://www.tri-c.edu,"Cleveland metro, multiple campuses"
Columbus State Community College,Community College,Ohio,Columbus,"Business, Technology, Healthcare",26000,580,Yes,"$4,000","$8,500","$1,089",28%,38%,62%,580,(614) 287-5353,veterans@cscc.edu,https://www.cscc.edu,"State capital, comprehensive"
Sinclair Community College,Community College,Ohio,Dayton,"Liberal Arts, Healthcare, Technology",19000,425,Yes,"$3,900","$7,800","$1,089",35%,45%,68%,425,(937) 512-3000,veterans@sinclair.edu,https://www.sinclair.edu,"Dayton area, strong programs"
Lakeland Community College,Community College,Ohio,Kirtland,"Business, Technology, Healthcare",8500,200,Yes,"$3,700","$7,200","$1,089",38%,46%,70%,200,(440) 525-7000,veterans@lakelandcc.edu,https://www.lakelandcc.edu,"Northeast Ohio, comprehensive"
Tulsa Community College,Community College,Oklahoma,Tulsa,"Liberal Arts, Healthcare, Technology",18000,420,Yes,"$3,400","$9,800","$1,089",36%,45%,68%,420,(918) 595-7000,veterans@tulsacc.edu,https://www.tulsacc.edu,"Multiple campuses, comprehensive"
Oklahoma City Community College,Community College,Oklahoma,Oklahoma City,"Business, Technology, Healthcare,15000,350,Yes,"$3,500","$9,900","$1,089",42%,50%,72%,350,(405) 682-1611,veterans@occc.edu,https://www.occc.edu,"State capital, strong programs"
Portland Community College,Community College,Oregon,Portland,"Liberal Arts, Healthcare, Technology",90000,1850,Yes,"$4,900","$10,800","$1,881",32%,42%,65%,1850,(971) 722-6111,veterans@pcc.edu,https://www.pcc.edu,"Largest in Oregon, four campuses"
Lane Community College,Community College,Oregon,Eugene,"Liberal Arts, Healthcare, Technology",9000,215,Yes,"$4,800","$11,200","$1,683",38%,46%,68%,215,(541) 463-3000,veterans@lanecc.edu,https://www.lanecc.edu,"Eugene area, strong programs"
Community College of Philadelphia,Community College,Pennsylvania,Philadelphia,"Liberal Arts, Healthcare, Technology",19000,445,Yes,"$5,500","$11,200","$2,181",24%,35%,58%,445,(215) 751-8010,veterans@ccp.edu,https://www.ccp.edu,"Urban campus, diverse programs"
Harrisburg Area Community College,Community College,Pennsylvania,Harrisburg,"Business, Technology, Healthcare",18000,410,Yes,"$5,700","$11,600","$1,485",32%,42%,65%,410,(717) 780-2300,veterans@hacc.edu,https://www.hacc.edu,"Multiple campuses, state capital area"
Delaware County Community College,Community College,Pennsylvania,Media,"Liberal Arts, Healthcare, Technology",12000,285,Yes,"$5,600","$11,400","$2,181",36%,45%,68%,285,(610) 359-5000,veterans@dccc.edu,https://www.dccc.edu,"Philadelphia suburbs, comprehensive"
Bucks County Community College,Community College,Pennsylvania,Newtown,"Business, Technology, Healthcare",9500,225,Yes,"$5,800","$11,800","$2,181",38%,46%,70%,225,(215) 968-8000,veterans@bucks.edu,https://www.bucks.edu,"Philadelphia suburbs, strong programs"
Community College of Rhode Island,Community College,Rhode Island,Warwick,"Liberal Arts, Healthcare, Technology",16000,370,Yes,"$4,600","$12,500","$1,836",26%,36%,60%,370,(401) 825-1000,veterans@ccri.edu,https://www.ccri.edu,"Multiple campuses, comprehensive"
Trident Technical College,Community College,South Carolina,Charleston,"Technology, Healthcare, Business",12000,310,Yes,"$5,200","$9,400","$1,386",38%,48%,70%,310,(843) 574-6111,veterans@tridenttech.edu,https://www.tridenttech.edu,"Coastal location, strong programs"
Midlands Technical College,Community College,South Carolina,Columbia,"Business, Technology, Healthcare",11000,275,Yes,"$5,100","$10,200","$1,386",36%,46%,68%,275,(803) 738-8324,veterans@midlandstech.edu,https://www.midlandstech.edu,"State capital, comprehensive"
Greenville Technical College,Community College,South Carolina,Greenville,"Technology, Healthcare, Business",13000,320,Yes,"$5,000","$9,800","$1,386",42%,52%,74%,320,(864) 250-8111,veterans@gvltec.edu,https://www.gvltec.edu,"Upstate SC, BMW partnership"
