school_name,school_type,state,city,programs_offered,total_enrollment,veteran_enrollment,yellow_ribbon_program,in_state_tuition,out_of_state_tuition,housing_allowance_rate,graduation_rate,veteran_graduation_rate,post_graduation_employment_rate,gi_bill_students,veteran_services_office,contact_phone,contact_email,website,notes
Delgado Community College,Community College,Louisiana,New Orleans,"Liberal Arts, Health, Business, Maritime, Culinary",15000,2450,No,4074,8850,1932,30%,37%,67%,2450,Yes,(504) 671-5000,veterans@dcc.edu,https://www.dcc.edu,Largest Louisiana CC
Bossier Parish Community College,Community College,Louisiana,Bossier City,"Liberal Arts, Health, Business, Industrial, Aviation",6000,1850,No,4074,8850,1335,32%,39%,68%,1850,Yes,(318) 678-6000,veterans@bpcc.edu,https://www.bpcc.edu,Northwest Louisiana
River Parishes Community College,Community College,Louisiana,Sorrento,"Liberal Arts, Business, Health, Process Tech, Industrial",2500,780,No,4074,8850,1665,27%,34%,64%,780,Yes,(225) 675-8270,veterans@rpcc.edu,https://www.rpcc.edu,Between Baton Rouge and NOLA
Nunez Community College,Community College,Louisiana,Chalmette,"Liberal Arts, Nursing, Business, Emergency Medical, IT",2000,680,No,4074,8850,1932,29%,36%,66%,680,Yes,(504) 278-6200,veterans@nunez.edu,https://www.nunez.edu,New Orleans metro
Central Georgia Technical College,Community College,Georgia,Macon,"Health, Business, Industrial, IT, Public Safety",8000,1980,No,3300,6000,1335,44%,50%,74%,1980,Yes,(478) 757-3400,veterans@centralgatech.edu,https://www.centralgatech.edu,Central Georgia
Gwinnett Technical College,Community College,Georgia,Lawrenceville,"Health, Business, IT, Industrial, Public Safety",7500,1850,No,3300,6000,1932,42%,48%,73%,1850,Yes,(770) 962-7580,veterans@gwinnettech.edu,https://www.gwinnettech.edu,Atlanta metro
Georgia Piedmont Technical College,Community College,Georgia,Clarkston,"Health, Business, IT, Industrial, Logistics",4500,1350,No,3300,6000,1932,38%,44%,70%,1350,Yes,(404) 297-9522,veterans@gptc.edu,https://www.gptc.edu,DeKalb County
Chattahoochee Technical College,Community College,Georgia,Marietta,"Health, Business, IT, Industrial, Aviation",11000,2250,No,3300,6000,1932,45%,51%,75%,2250,Yes,(770) 528-4545,veterans@chattahoocheetech.edu,https://www.chattahoocheetech.edu,Northwest Atlanta metro
Columbus Technical College,Community College,Georgia,Columbus,"Health, Business, IT, Industrial, Public Safety",3500,1150,No,3300,6000,1335,41%,47%,72%,1150,Yes,(706) 649-1800,veterans@columbustech.edu,https://www.columbustech.edu,Near Fort Moore
Athens Technical College,Community College,Georgia,Athens,"Health, Business, IT, Industrial, Veterinary Tech",4000,1280,No,3300,6000,1335,43%,49%,73%,1280,Yes,(706) 355-5000,veterans@athenstech.edu,https://www.athenstech.edu,Northeast Georgia
Savannah Technical College,Community College,Georgia,Savannah,"Health, Business, Industrial, Culinary, Maritime",4500,1380,No,3300,6000,1335,40%,46%,71%,1380,Yes,(912) 443-5700,veterans@savannahtech.edu,https://www.savannahtech.edu,Coastal Georgia
Wiregrass Georgia Technical College,Community College,Georgia,Valdosta,"Health, Business, IT, Industrial, Agriculture",4000,1280,No,3300,6000,1335,39%,45%,70%,1280,Yes,(229) 333-2100,veterans@wiregrass.edu,https://www.wiregrass.edu,South Georgia
Lanier Technical College,Community College,Georgia,Oakwood,"Health, Business, IT, Industrial, Agriculture",5000,1450,No,3300,6000,1335,42%,48%,72%,1450,Yes,(770) 531-6300,veterans@laniertech.edu,https://www.laniertech.edu,Northeast Georgia
West Georgia Technical College,Community College,Georgia,Waco,"Health, Business, IT, Industrial, Public Safety",7000,1780,No,3300,6000,1335,41%,47%,71%,1780,Yes,(770) 537-6000,veterans@westgatech.edu,https://www.westgatech.edu,West of Atlanta
Lone Star College,Community College,Texas,The Woodlands,"Liberal Arts, Health, Business, IT, Process Tech",90000,5200,No,2550,5100,1551,26%,33%,64%,5200,Yes,(832) 813-6500,veterans@lonestar.edu,https://www.lonestar.edu,Largest Texas CC system
San Antonio College,Community College,Texas,San Antonio,"Liberal Arts, Health, Business, Veterinary Tech, Aviation",20000,3850,No,2760,7140,1551,31%,38%,67%,3850,Yes,(210) 486-0000,veterans@alamo.edu,https://www.alamo.edu/sac,Alamo Colleges District
Palo Alto College,Community College,Texas,San Antonio,"Liberal Arts, Health, Business, Aviation, Biotechnology",9000,2950,No,2760,7140,1551,28%,35%,65%,2950,Yes,(210) 486-3000,veterans@alamo.edu,https://www.alamo.edu/pac,Alamo Colleges District
St. Philip's College,Community College,Texas,San Antonio,"Liberal Arts, Health, Business, Aviation, Culinary",12000,3150,No,2760,7140,1551,30%,37%,66%,3150,Yes,(210) 486-2000,veterans@alamo.edu,https://www.alamo.edu/spc,Alamo Colleges HBCU
Northeast Lakeview College,Community College,Texas,San Antonio,"Liberal Arts, Health, Business, IT, Hospitality",8000,2450,No,2760,7140,1551,29%,36%,65%,2450,Yes,(210) 486-5000,veterans@alamo.edu,https://www.alamo.edu/nlc,Newest Alamo College
Northwest Vista College,Community College,Texas,San Antonio,"Liberal Arts, Health, Business, IT, Emergency Services",17000,3550,No,2760,7140,1551,27%,34%,64%,3550,Yes,(210) 486-4000,veterans@alamo.edu,https://www.alamo.edu/nvc,Alamo Colleges District
Dallas College,Community College,Texas,Dallas,"Liberal Arts, Health, Business, Fashion, Media",95000,5450,No,2070,5610,1551,25%,32%,63%,5450,Yes,(214) 378-1700,veterans@dallascollege.edu,https://www.dallascollege.edu,Seven campus system
Collin College,Community College,Texas,McKinney,"Liberal Arts, Health, Business, IT, Fire Science",60000,3950,No,2070,6120,1551,34%,40%,69%,3950,Yes,(972) 881-5790,veterans@collin.edu,https://www.collin.edu,North Dallas suburbs
North Lake College,Community College,Texas,Irving,"Liberal Arts, Health, Business, Aviation, Hospitality",12000,2250,No,2070,5610,1551,28%,35%,65%,2250,Yes,(972) 273-3000,veterans@dcccd.edu,https://www.northlakecollege.edu,Dallas County CCD
Brookhaven College,Community College,Texas,Farmers Branch,"Liberal Arts, Health, Business, IT, Horticulture",13000,2350,No,2070,5610,1551,30%,37%,66%,2350,Yes,(972) 860-4700,veterans@dcccd.edu,https://www.brookhavencollege.edu,Dallas County CCD
Cedar Valley College,Community College,Texas,Lancaster,"Liberal Arts, Health, Business, IT, Aviation",8000,1850,No,2070,5610,1551,26%,33%,64%,1850,Yes,(972) 860-8201,veterans@dcccd.edu,https://www.cedarvalleycollege.edu,Dallas County CCD
Eastfield College,Community College,Texas,Mesquite,"Liberal Arts, Health, Business, IT, Emergency Services",12000,2250,No,2070,5610,1551,27%,34%,65%,2250,Yes,(972) 860-7100,veterans@dcccd.edu,https://www.eastfieldcollege.edu,Dallas County CCD
El Centro College,Community College,Texas,Dallas,"Liberal Arts, Health, Business, Culinary, Hospitality",10000,2150,No,2070,5610,1551,29%,36%,66%,2150,Yes,(214) 860-2000,veterans@dcccd.edu,https://www.elcentrocollege.edu,Downtown Dallas
Mountain View College,Community College,Texas,Dallas,"Liberal Arts, Health, Business, IT, Sustainable Living",8000,1950,No,2070,5610,1551,28%,35%,65%,1950,Yes,(214) 860-8600,veterans@dcccd.edu,https://www.mountainviewcollege.edu,Dallas County CCD
Richland College,Community College,Texas,Dallas,"Liberal Arts, Health, Business, IT, Sustainability",15000,2550,No,2070,5610,1551,31%,38%,67%,2550,Yes,(972) 238-6194,veterans@dcccd.edu,https://www.richlandcollege.edu,Dallas County CCD
College of the Mainland,Community College,Texas,Texas City,"Liberal Arts, Health, Business, Process Tech, Maritime",4000,1280,No,3300,6180,1665,27%,34%,64%,1280,Yes,(409) 938-1211,veterans@com.edu,https://www.com.edu,Gulf Coast
Kilgore College,Community College,Texas,Kilgore,"Liberal Arts, Health, Business, Petroleum, Ranching",6000,1650,No,3030,5280,1209,35%,41%,69%,1650,Yes,(903) 984-8531,veterans@kilgore.edu,https://www.kilgore.edu,East Texas
Temple College,Community College,Texas,Temple,"Liberal Arts, Health, Business, IT, Emergency Medical",6000,1850,No,2940,5520,1209,33%,39%,68%,1850,Yes,(254) 298-8282,veterans@templejc.edu,https://www.templejc.edu,Central Texas near Fort Cavazos
McLennan Community College,Community College,Texas,Waco,"Liberal Arts, Health, Business, Respiratory, IT",9000,2150,No,3090,5700,1209,32%,38%,67%,2150,Yes,(254) 299-8622,veterans@mclennan.edu,https://www.mclennan.edu,Central Texas
Blinn College,Community College,Texas,Brenham,"Liberal Arts, Health, Business, Agriculture, Fire Science",19000,2850,No,3690,6900,1551,48%,54%,76%,2850,Yes,(979) 830-4000,veterans@blinn.edu,https://www.blinn.edu,Strong A&M transfer
Alvin Community College,Community College,Texas,Alvin,"Liberal Arts, Health, Business, Process Tech, Respiratory",5500,1650,No,2040,4680,1665,34%,40%,68%,1650,Yes,(281) 756-3500,veterans@alvincollege.edu,https://www.alvincollege.edu,Houston area
College of the Sequoias,Community College,California,Visalia,"Liberal Arts, Health, Business, Agriculture, Fire Tech",11000,2150,No,1288,7944,2157,45%,51%,74%,2150,Yes,(559) 730-3700,veterans@cos.edu,https://www.cos.edu,Central Valley
Fresno City College,Community College,California,Fresno,"Liberal Arts, Health, Business, Automotive, Aviation",22000,2850,No,1288,7944,2157,44%,50%,73%,2850,Yes,(559) 442-4600,veterans@fresnocitycollege.edu,https://www.fresnocitycollege.edu,Central Valley
Bakersfield College,Community College,California,Bakersfield,"Liberal Arts, Health, Business, Fire, Industrial",18000,2650,No,1288,7944,2157,42%,48%,72%,2650,Yes,(661) 395-4011,veterans@bakersfieldcollege.edu,https://www.bakersfieldcollege.edu,Kern County
Cerro Coso Community College,Community College,California,Ridgecrest,"Liberal Arts, Health, Business, Aviation, Paralegal",5000,1480,No,1288,7944,2373,38%,44%,70%,1480,Yes,(760) 384-6100,veterans@cerrocoso.edu,https://www.cerrocoso.edu,Near China Lake NAWS
Riverside City College,Community College,California,Riverside,"Liberal Arts, Health, Business, Digital Media, Fire",19000,2750,No,1288,7944,2502,43%,49%,73%,2750,Yes,(951) 222-8000,veterans@rcc.edu,https://www.rcc.edu,Inland Empire
Chaffey College,Community College,California,Rancho Cucamonga,"Liberal Arts, Health, Business, Agriculture, Auto Tech",18000,2680,No,1288,7944,2502,46%,52%,74%,2680,Yes,(909) 652-6000,veterans@chaffey.edu,https://www.chaffey.edu,Inland Empire
San Bernardino Valley College,Community College,California,San Bernardino,"Liberal Arts, Health, Business, Automotive, Water Tech",14000,2550,No,1288,7944,2502,41%,47%,71%,2550,Yes,(909) 384-4400,veterans@valleycollege.edu,https://www.valleycollege.edu,Inland Empire
Mt. San Antonio College,Community College,California,Walnut,"Liberal Arts, Health, Business, Aviation, Wildlife",28000,3150,No,1288,7944,2502,47%,53%,75%,3150,Yes,(909) 274-7500,veterans@mtsac.edu,https://www.mtsac.edu,Large So Cal CC
Pasadena City College,Community College,California,Pasadena,"Liberal Arts, Health, Business, Fashion, Media",26000,2950,No,1288,7944,2760,49%,55%,76%,2950,Yes,(626) 585-7123,veterans@pasadena.edu,https://www.pasadena.edu,San Gabriel Valley
Glendale Community College,Community College,California,Glendale,"Liberal Arts, Health, Business, Culinary, Aviation",15000,2450,No,1288,7944,2760,48%,54%,75%,2450,Yes,(818) 240-1000,veterans@glendale.edu,https://www.glendale.edu,Los Angeles area
Los Angeles City College,Community College,California,Los Angeles,"Liberal Arts, Health, Business, Cinema, Theatre",18000,2680,No,1288,7944,2973,40%,46%,71%,2680,Yes,(323) 953-4000,veterans@lacitycollege.edu,https://www.lacitycollege.edu,Hollywood area
East Los Angeles College,Community College,California,Monterey Park,"Liberal Arts, Health, Business, Administration of Justice",22000,2850,No,1288,7944,2973,44%,50%,73%,2850,Yes,(323) 265-8650,veterans@elac.edu,https://www.elac.edu,East LA
Los Angeles Pierce College,Community College,California,Woodland Hills,"Liberal Arts, Health, Business, Veterinary, Agriculture",20000,2750,No,1288,7944,2973,46%,52%,74%,2750,Yes,(818) 719-6401,veterans@piercecollege.edu,https://www.piercecollege.edu,San Fernando Valley
Los Angeles Valley College,Community College,California,Valley Glen,"Liberal Arts, Health, Business, Media, Aviation",18000,2650,No,1288,7944,2973,45%,51%,73%,2650,Yes,(818) 947-2600,veterans@lavc.edu,https://www.lavc.edu,San Fernando Valley
Los Angeles Trade-Technical College,Community College,California,Los Angeles,"Liberal Arts, Culinary, Fashion, Welding, Construction",12000,2350,No,1288,7944,2973,39%,45%,70%,2350,Yes,(213) 763-7000,veterans@lattc.edu,https://www.lattc.edu,Downtown LA trades
Los Angeles Southwest College,Community College,California,Los Angeles,"Liberal Arts, Health, Business, Child Development",7000,1850,No,1288,7944,2973,37%,43%,69%,1850,Yes,(323) 241-5225,veterans@lasc.edu,https://www.lasc.edu,South LA
West Los Angeles College,Community College,California,Culver City,"Liberal Arts, Dental Hygiene, Business, Aviation, Media",10000,2150,No,1288,7944,2973,42%,48%,72%,2150,Yes,(310) 287-4200,veterans@wlac.edu,https://www.wlac.edu,Westside LA
Long Beach City College,Community College,California,Long Beach,"Liberal Arts, Health, Business, Aviation, Fire",25000,2950,No,1288,7944,2760,44%,50%,73%,2950,Yes,(562) 938-4353,veterans@lbcc.edu,https://www.lbcc.edu,South Bay
Cerritos College,Community College,California,Norwalk,"Liberal Arts, Dental Hygiene, Business, Auto, Cosmetology",21000,2850,No,1288,7944,2760,47%,53%,75%,2850,Yes,(562) 860-2451,veterans@cerritos.edu,https://www.cerritos.edu,Southeast LA County
Cypress College,Community College,California,Cypress,"Liberal Arts, Dental Hygiene, Business, Mortuary, Veterinary",13000,2450,No,1288,7944,2373,46%,52%,74%,2450,Yes,(714) 484-7000,veterans@cypresscollege.edu,https://www.cypresscollege.edu,North Orange County
Fullerton College,Community College,California,Fullerton,"Liberal Arts, Health, Business, Horticulture, Fire",21000,2850,No,1288,7944,2373,50%,56%,76%,2850,Yes,(714) 992-7000,veterans@fullcoll.edu,https://www.fullcoll.edu,North Orange County
Golden West College,Community College,California,Huntington Beach,"Liberal Arts, Nursing, Business, Police, Fire",12000,2350,No,1288,7944,2373,48%,54%,75%,2350,Yes,(714) 892-7711,veterans@gwc.cccd.edu,https://www.goldenwestcollege.edu,Orange County coast
Orange Coast College,Community College,California,Costa Mesa,"Liberal Arts, Sailing, Business, Aviation, Film",22000,2950,No,1288,7944,2373,52%,58%,77%,2950,Yes,(714) 432-5072,veterans@occ.cccd.edu,https://www.orangecoastcollege.edu,Orange County
Santiago Canyon College,Community College,California,Orange,"Liberal Arts, Biological Sciences, Graphic Design, Business",11000,2250,No,1288,7944,2373,49%,55%,76%,2250,Yes,(714) 628-4900,veterans@sccollege.edu,https://www.sccollege.edu,Orange County
Santa Ana College,Community College,California,Santa Ana,"Liberal Arts, Occupational Therapy, Business, Digital Media",18000,2650,No,1288,7944,2373,45%,51%,73%,2650,Yes,(714) 564-6000,veterans@sac.edu,https://www.sac.edu,Central Orange County
Irvine Valley College,Community College,California,Irvine,"Liberal Arts, Health, Business, Laser Technology, Photography",14000,2450,No,1288,7944,2502,51%,57%,77%,2450,Yes,(949) 451-5100,veterans@ivc.edu,https://www.ivc.edu,South Orange County
Saddleback College,Community College,California,Mission Viejo,"Liberal Arts, Health, Business, Aviation, Marine",18000,2750,No,1288,7944,2373,49%,55%,76%,2750,Yes,(949) 582-4500,veterans@saddleback.edu,https://www.saddleback.edu,South Orange County
Palomar College,Community College,California,San Marcos,"Liberal Arts, Health, Business, Fire, Law Enforcement",24000,2950,No,1288,7944,2760,47%,53%,75%,2950,Yes,(760) 744-1150,veterans@palomar.edu,https://www.palomar.edu,North San Diego County
MiraCosta College,Community College,California,Oceanside,"Liberal Arts, Biotechnology, Business, Horticulture, Music",14000,2550,No,1288,7944,2760,50%,56%,76%,2550,Yes,(760) 757-2121,veterans@miracosta.edu,https://www.miracosta.edu,North County coastal
Southwestern College,Community College,California,Chula Vista,"Liberal Arts, Health, Business, Public Safety, Dental",19000,2780,No,1288,7944,2760,43%,49%,72%,2780,Yes,(619) 421-6700,veterans@swccd.edu,https://www.swccd.edu,South San Diego County
Grossmont College,Community College,California,El Cajon,"Liberal Arts, Health, Business, Cardiovascular, Orthopedic",17000,2680,No,1288,7944,2760,48%,54%,75%,2680,Yes,(619) 644-7000,veterans@grossmont.edu,https://www.grossmont.edu,East San Diego County
Cuyamaca College,Community College,California,El Cajon,"Liberal Arts, Automotive, Business, Water/Wastewater, Ornamental",9000,2150,No,1288,7944,2760,46%,52%,74%,2150,Yes,(619) 660-4000,veterans@cuyamaca.edu,https://www.cuyamaca.edu,East San Diego County
San Diego City College,Community College,California,San Diego,"Liberal Arts, Health, Business, Graphic Design, Culinary",16000,2580,No,1288,7944,2760,44%,50%,73%,2580,Yes,(619) 388-3400,veterans@sdccd.edu,https://www.sdcity.edu,Downtown San Diego
San Diego Miramar College,Community College,California,San Diego,"Liberal Arts, Aviation, Business, Diesel, Fire",13000,2450,No,1288,7944,2760,47%,53%,75%,2450,Yes,(619) 388-7800,veterans@sdmiramar.edu,https://www.sdmiramar.edu,Near MCAS Miramar
Diablo Valley College,Community College,California,Pleasant Hill,"Liberal Arts, Health, Business, Culinary, Dental",21000,2850,No,1288,7944,2973,52%,58%,77%,2850,Yes,(925) 685-1230,veterans@dvc.edu,https://www.dvc.edu,East Bay
Contra Costa College,Community College,California,San Pablo,"Liberal Arts, Dental Hygiene, Business, Culinary, Photography",6500,1850,No,1288,7944,2973,40%,46%,71%,1850,Yes,(510) 235-7800,veterans@contracosta.edu,https://www.contracosta.edu,West Contra Costa
Los Medanos College,Community College,California,Pittsburg,"Liberal Arts, Health, Business, Administration of Justice",9000,2150,No,1288,7944,2973,43%,49%,72%,2150,Yes,(925) 439-2181,veterans@losmedanos.edu,https://www.losmedanos.edu,East Contra Costa
Las Positas College,Community College,California,Livermore,"Liberal Arts, Health, Business, Viticulture, Fire",8000,1950,No,1288,7944,2973,45%,51%,73%,1950,Yes,(925) 424-1000,veterans@laspositascollege.edu,https://www.laspositascollege.edu,Tri-Valley
Chabot College,Community College,California,Hayward,"Liberal Arts, Dental Hygiene, Business, Fire, Automotive",13000,2450,No,1288,7944,2973,46%,52%,74%,2450,Yes,(510) 723-6600,veterans@chabotcollege.edu,https://www.chabotcollege.edu,East Bay
Ohlone College,Community College,California,Fremont,"Liberal Arts, Health, Business, Horticulture, Fire",11000,2250,No,1288,7944,2973,48%,54%,75%,2250,Yes,(510) 659-6000,veterans@ohlone.edu,https://www.ohlone.edu,East Bay
Mission College,Community College,California,Santa Clara,"Liberal Arts, Health, Business, Engineering, Diagnostic Medical",7500,1950,No,1288,7944,3003,47%,53%,75%,1950,Yes,(408) 988-2200,veterans@missioncollege.edu,https://www.missioncollege.edu,Silicon Valley
De Anza College,Community College,California,Cupertino,"Liberal Arts, Health, Business, Winemaking, Animation",21000,2850,No,1288,7944,3003,53%,59%,78%,2850,Yes,(408) 864-5678,veterans@deanza.edu,https://www.deanza.edu,Silicon Valley
Foothill College,Community College,California,Los Altos Hills,"Liberal Arts, Dental Hygiene, Business, Veterinary, Radiologic",15000,2550,No,1288,7944,3003,54%,60%,79%,2550,Yes,(650) 949-7777,veterans@foothill.edu,https://www.foothill.edu,Silicon Valley
West Valley College,Community College,California,Saratoga,"Liberal Arts, Health, Business, Interior Design, Fashion",9000,2050,No,1288,7944,3003,49%,55%,76%,2050,Yes,(408) 867-2200,veterans@westvalley.edu,https://www.westvalley.edu,Silicon Valley
Evergreen Valley College,Community College,California,San Jose,"Liberal Arts, Health, Business, Aviation, Photography",9500,2150,No,1288,7944,3003,45%,51%,73%,2150,Yes,(408) 274-7900,veterans@evc.edu,https://www.evc.edu,East San Jose
San Jose City College,Community College,California,San Jose,"Liberal Arts, Dental Hygiene, Business, Fire, Interior Design",8000,1950,No,1288,7944,3003,44%,50%,72%,1950,Yes,(408) 288-3700,veterans@sjcc.edu,https://www.sjcc.edu,Downtown San Jose
Canada College,Community College,California,Redwood City,"Liberal Arts, Radiologic, Business, Fashion, Kinesiology",6000,1750,No,1288,7944,3003,48%,54%,75%,1750,Yes,(650) 306-3100,veterans@canadacollege.edu,https://www.canadacollege.edu,San Mateo County
College of San Mateo,Community College,California,San Mateo,"Liberal Arts, Dental Hygiene, Business, Cosmetology, Automotive",9000,2050,No,1288,7944,3003,50%,56%,76%,2050,Yes,(650) 574-6161,veterans@collegeofsanmateo.edu,https://www.collegeofsanmateo.edu,San Mateo County
Skyline College,Community College,California,San Bruno,"Liberal Arts, Respiratory, Business, Cosmetology, Automotive",8500,1950,No,1288,7944,3003,47%,53%,75%,1950,Yes,(650) 738-4100,veterans@skylinecollege.edu,https://www.skylinecollege.edu,Near SFO airport
City College of San Francisco,Community College,California,San Francisco,"Liberal Arts, Health, Business, Culinary, Aviation",60000,4200,No,1288,7944,3003,42%,48%,71%,4200,Yes,(415) 239-3000,veterans@ccsf.edu,https://www.ccsf.edu,Largest SF college
Laney College,Community College,California,Oakland,"Liberal Arts, Carpentry, Business, Machining, Welding",12000,2350,No,1288,7944,2973,38%,44%,69%,2350,Yes,(510) 834-5740,veterans@laney.edu,https://www.laney.edu,Peralta District
Merritt College,Community College,California,Oakland,"Liberal Arts, Health, Business, Landscape, Fire",6000,1750,No,1288,7944,2973,36%,42%,68%,1750,Yes,(510) 434-3900,veterans@merritt.edu,https://www.merritt.edu,Oakland hills
College of Alameda,Community College,California,Alameda,"Liberal Arts, Health, Business, Aviation, Dental Hygiene",6500,1850,No,1288,7944,2973,37%,43%,69%,1850,Yes,(510) 522-7221,veterans@peralta.edu,https://www.alameda.peralta.edu,Island campus
Berkeley City College,Community College,California,Berkeley,"Liberal Arts, Business, Biotechnology, Multimedia, Community Health",7000,1950,No,1288,7944,3003,39%,45%,70%,1950,Yes,(510) 981-2800,veterans@berkeleycitycollege.edu,https://www.berkeleycitycollege.edu,Downtown Berkeley
Solano Community College,Community College,California,Fairfield,"Liberal Arts, Health, Business, Fire, Biotechnology",11000,2450,No,1288,7944,2760,41%,47%,71%,2450,Yes,(707) 864-7000,veterans@solano.edu,https://www.solano.edu,Near Travis AFB
Napa Valley College,Community College,California,Napa,"Liberal Arts, Health, Business, Viticulture, Culinary",7000,1850,No,1288,7944,2760,44%,50%,73%,1850,Yes,(707) 256-7000,veterans@napavalley.edu,https://www.napavalley.edu,Wine country
Santa Rosa Junior College,Community College,California,Santa Rosa,"Liberal Arts, Health, Business, Agriculture, Fire",24000,2950,No,1288,7944,2760,49%,55%,76%,2950,Yes,(707) 527-4011,veterans@santarosa.edu,https://www.santarosa.edu,Sonoma County
College of Marin,Community College,California,Kentfield,"Liberal Arts, Health, Business, Fire, Landscape",7500,1950,No,1288,7944,3003,45%,51%,73%,1950,Yes,(415) 457-8811,veterans@marin.edu,https://www.marin.edu,Marin County
Front Range Community College,Community College,Colorado,Westminster,"Business, Technology, Healthcare, Liberal Arts",25000,450,Yes,"$4,200","$15,800","$1,953",45%,52%,72%,450,(720) 466-1600,veteran.services@frontrange.edu,https://www.frontrange.edu,"Multiple campuses, strong transfer programs"
Red Rocks Community College,Community College,Colorado,Lakewood,"Business, Arts, Science, Technology",8500,180,Yes,"$4,100","$15,400","$1,953",48%,55%,68%,180,(303) 914-6600,veterans@rrcc.edu,https://www.rrcc.edu,"Scenic campus, outdoor recreation programs"
Pikes Peak Community College,Community College,Colorado,Colorado Springs,"Military Studies, Healthcare, Technology",12000,650,Yes,"$4,300","$15,900","$1,953",42%,58%,75%,650,(719) 502-2000,military@pikespeak.edu,https://www.pikespeak.edu,"Near Fort Carson, military-friendly"
Community College of Denver,Community College,Colorado,Denver,"Liberal Arts, Healthcare, Business",8000,200,Yes,"$4,400","$16,200","$1,953",35%,48%,65%,200,(303) 556-2600,veteranservices@ccd.edu,https://www.ccd.edu,"Urban campus, diverse programs"
Arapahoe Community College,Community College,Colorado,Littleton,"Business, Technology, Healthcare",7500,175,Yes,"$4,200","$15,700","$1,953",46%,53%,70%,175,(303) 797-4222,veterans@arapahoe.edu,https://www.arapahoe.edu,"Transfer-focused, strong academics"
Gateway Community College,Community College,Connecticut,New Haven,"Liberal Arts, Healthcare, Technology",6800,145,Yes,"$4,200","$12,600","$1,836",38%,45%,68%,145,(203) 285-2000,veterans@gwcc.commnet.edu,https://www.gwcc.commnet.edu,"Urban campus, diverse student body"
Housatonic Community College,Community College,Connecticut,Bridgeport,"Business, Arts, Science",5200,120,Yes,"$4,200","$12,600","$1,836",42%,50%,72%,120,(203) 332-5000,veterans@hcc.commnet.edu,https://www.hcc.commnet.edu,"Affordable, transfer programs"
Middlesex Community College,Community College,Connecticut,Middletown,"Liberal Arts, Healthcare, Technology",2800,65,Yes,"$4,200","$12,600","$1,836",45%,52%,75%,65,(860) 343-5800,veterans@mxcc.commnet.edu,https://www.mxcc.commnet.edu,"Small class sizes, personal attention"
Norwalk Community College,Community College,Connecticut,Norwalk,"Business, Technology, Healthcare",5500,110,Yes,"$4,200","$12,600","$1,836",48%,55%,78%,110,(203) 857-7000,veterans@ncc.commnet.edu,https://www.ncc.commnet.edu,"Coastal location, strong programs"
Delaware Technical Community College,Community College,Delaware,Dover,"Technology, Healthcare, Business",12000,280,Yes,"$3,900","$10,200","$1,584",42%,50%,74%,280,(302) 857-1000,veterans@dtcc.edu,https://www.dtcc.edu,"Multiple campuses statewide"
Miami Dade College,Community College,Florida,Miami,"Liberal Arts, Healthcare, Technology",165000,2500,Yes,"$2,800","$10,500","$1,779",32%,42%,65%,2500,(305) 237-8888,veterans@mdc.edu,https://www.mdc.edu,"Largest community college in US"
