Keyword,Monthly Search Volume,Competition Level,Top Ranking Sites,Content Gap Opportunity,Category,Opportunity Score,Notes
military transition,14800,High,"VA.gov, Military.com, Transition Assistance Program",Create state-specific transition guides,General Transition,65,High volume but competitive
military to civilian transition,8100,High,"Military.com, Indeed.com, VA.gov",Personal success stories and case studies,General Transition,70,Good conversion potential
transitioning out of the military,5400,Medium,"Military.com, VA.gov, LinkedIn",Step-by-step transition timeline tool,General Transition,75,Lower competition
military separation checklist,2900,Medium,"Military.com, VA.gov",Interactive digital checklist tool,General Transition,80,High intent keyword
leaving the military,2400,Medium,"Reddit, Military.com, VA.gov",Emotional/mental health focused content,General Transition,75,Underserved angle
military retirement transition,1900,Medium,"Military.com, VA.gov, MOAA.org",Retirement-specific planning tools,General Transition,78,Niche opportunity
life after military,1600,Medium,"Military.com, Reddit, Medium",Lifestyle and identity content,General Transition,72,Content gap exists
military discharge process,1300,Low,"Military.com, VA.gov, TheBalanceCareers",Discharge type explanations,General Transition,82,Low competition
transitioning military members,1000,Low,"VA.gov, DOL.gov",Resource aggregation page,General Transition,85,Low competition opportunity
military exit strategy,880,Low,"Military.com, Forbes",Strategic planning content,General Transition,88,Very low competition

army mos to civilian jobs,6600,High,"Military.com, O*NET, VA.gov",MOS-specific career pathway guides,MOS Transition,72,High search volume
11b to civilian jobs,4400,Medium,"Military.com, Indeed, Reddit",Infantry-specific transition guide,MOS Transition,85,Very specific intent
25b to civilian jobs,3600,Medium,"Military.com, Indeed, Glassdoor",IT specialist transition guide,MOS Transition,87,High demand MOS
68w to civilian jobs,2900,Medium,"Military.com, Indeed, Healthcare sites",Combat medic to healthcare careers,MOS Transition,86,Healthcare pathway
35f to civilian jobs,2100,Medium,"Military.com, Indeed, Intelligence.gov",Intelligence analyst transition,MOS Transition,84,Growing field
92y to civilian jobs,1600,Low,"Military.com, Indeed",Supply specialist transition,MOS Transition,88,Low competition
31b to civilian jobs,1400,Low,"Military.com, Law Enforcement sites",Military police to civilian LE,MOS Transition,89,Good opportunity
88m to civilian jobs,1300,Low,"Military.com, Indeed, Trucking sites",Motor transport to logistics,MOS Transition,90,Commercial driving angle
12b to civilian jobs,1100,Low,"Military.com, Construction sites",Combat engineer transition,MOS Transition,91,Construction industry gap
15t to civilian jobs,950,Low,"Military.com, Aviation sites",Aviation maintenance careers,MOS Transition,92,Aviation niche

air force jobs to civilian,3600,High,"Military.com, VA.gov, Indeed",AFSC-specific transition guides,MOS Transition,75,Branch-specific content
afsc to civilian jobs,2400,Medium,"Military.com, Indeed",Air Force career translator,MOS Transition,82,AFSC focus needed
navy rate to civilian job,1900,Medium,"Military.com, Navy.com",Navy rating transition guide,MOS Transition,83,Navy-specific gap
marine mos to civilian,1600,Medium,"Military.com, USMC, Indeed",Marine-specific pathways,MOS Transition,84,USMC focus
coast guard rate to civilian,620,Low,"Military.com, USCG.mil",Coast Guard career paths,MOS Transition,94,Very low competition

military skills translator,12100,High,"O*NET, Military.com, CareerOneStop",Enhanced interactive translator tool,MOS Transition,68,High volume
mos translator,8900,High,"O*NET, Military.com, VA.gov",Visual career pathway tool,MOS Transition,70,Competitive
military to civilian job translator,4400,High,"O*NET, Military.com, Indeed",Industry-specific translations,MOS Transition,73,High intent
translate military experience,2700,Medium,"Resume sites, Military.com",Resume translation templates,MOS Transition,78,Content opportunity
military job codes,1800,Medium,"O*NET, Military.com",Comprehensive MOS database,MOS Transition,80,Reference content
civilian equivalent military jobs,1500,Low,"Military.com, CareerOneStop",Job matching tool,MOS Transition,85,Tool opportunity

va disability claim,49500,Very High,"VA.gov, DisabledVeterans.org, Hill & Ponton",Simplified claims process guide,VA Claims,45,Extremely competitive
va disability,40500,Very High,"VA.gov, eBenefits, VSO sites",Easy-to-understand benefits guide,VA Claims,48,High volume/competition
va claim status,33100,Very High,"VA.gov, eBenefits.va.gov",Third-party claim tracker,VA Claims,42,VA.gov dominates
file va claim,22200,Very High,"VA.gov, VA Claims Insider, Disabled Veterans",Step-by-step filing guide,VA Claims,50,Very competitive
va disability rating,18100,Very High,"VA.gov, VA Claims Insider, Hill & Ponton",Rating calculator tool,VA Claims,52,Tool opportunity
increase va rating,12100,High,"VA Claims Insider, VA.gov, CCK Law",Evidence-based increase guide,VA Claims,65,Secondary claims focus
va secondary conditions,9900,High,"VA Claims Insider, Disabled Veterans",Comprehensive secondary conditions list,VA Claims,68,List/database opportunity
va nexus letter,8100,High,"VA Claims Insider, Medical sites",Nexus letter templates and guides,VA Claims,70,Template opportunity
va dbq forms,6600,High,"VA.gov, VA Claims Insider",DBQ completion guides,VA Claims,72,How-to content
va tdiu,5400,High,"VA Claims Insider, CCK Law, Hill & Ponton",TDIU eligibility calculator,VA Claims,73,Calculator tool

va sleep apnea claim,14800,High,"VA Claims Insider, Disabled Veterans, Medical",Sleep apnea claim guide,VA Claims,68,Condition-specific
va tinnitus rating,9900,High,"VA Claims Insider, Medical sites",Tinnitus claims guide,VA Claims,70,High volume condition
va back pain rating,8100,High,"VA Claims Insider, Medical sites",Back conditions guide,VA Claims,72,Common condition
va ptsd rating,6600,High,"VA Claims Insider, Mental Health sites",PTSD claims comprehensive guide,VA Claims,73,Mental health focus
va migraines rating,5400,Medium,"VA Claims Insider, Medical sites",Migraine claims guide,VA Claims,78,Growing claims area
va knee pain rating,4400,Medium,"VA Claims Insider, Medical sites",Knee condition ratings,VA Claims,80,Common MSK condition
va depression rating,3600,Medium,"VA Claims Insider, Mental Health",Depression claims guide,VA Claims,82,Mental health opportunity
va anxiety rating,2900,Medium,"VA Claims Insider, Mental Health",Anxiety claims guide,VA Claims,83,Mental health gap
va radiculopathy,2400,Medium,"VA Claims Insider, Medical sites",Radiculopathy claims guide,VA Claims,84,Technical condition
va hearing loss,1900,Medium,"VA Claims Insider, Audiology sites",Hearing loss ratings guide,VA Claims,85,Sensory condition

texas veteran benefits,9900,High,"Texas Veterans Commission, VA.gov, Military.com",Comprehensive TX benefits guide,State Benefits,70,Highest veteran population
florida veteran benefits,8100,High,"FloridaVets.org, VA.gov, Military.com",Complete FL benefits breakdown,State Benefits,72,Second largest population
california veteran benefits,6600,High,"CalVet.ca.gov, VA.gov, Military.com",CA benefits and resources,State Benefits,74,Third largest population
virginia veteran benefits,4400,Medium,"DVS.virginia.gov, VA.gov",VA state benefits (not federal),State Benefits,80,Naming confusion opportunity
north carolina veteran benefits,3600,Medium,"NC.gov/Veterans, VA.gov",NC-specific benefits guide,State Benefits,82,Large military presence
georgia veteran benefits,2900,Medium,"GDVS.georgia.gov, VA.gov",GA benefits comprehensive list,State Benefits,83,Growing veteran population
ohio veteran benefits,2400,Medium,"DVS.ohio.gov, VA.gov",OH benefits and services,State Benefits,84,Midwest opportunity
pennsylvania veteran benefits,2100,Medium,"DMVA.pa.gov, VA.gov",PA veteran resources,State Benefits,85,Northeast gap
arizona veteran benefits,1900,Medium,"AZDVS.gov, VA.gov",AZ benefits for veterans,State Benefits,86,Retirement destination
washington veteran benefits,1800,Medium,"DVA.wa.gov, VA.gov",WA state benefits guide,State Benefits,87,JBLM proximity

veteran property tax exemption,5400,High,"State sites, VA.gov, Tax sites",State-by-state comparison tool,State Benefits,75,Financial benefit
veteran hunting license,3600,Medium,"State DNR sites, Wildlife agencies",Free licenses by state guide,State Benefits,82,Lifestyle benefit
veteran fishing license,2900,Medium,"State DNR sites, Wildlife agencies",State fishing license guide,State Benefits,83,Lifestyle benefit
veteran tuition waiver,2400,Medium,"State university sites, VA.gov",State tuition benefits comparison,State Benefits,84,Education benefit
state veteran homes,1900,Medium,"VA.gov, State veteran agencies",State veterans homes directory,State Benefits,86,Housing benefit
veteran license plates,1600,Low,"DMV sites, State sites",How to get veteran plates guide,State Benefits,88,Documentation benefit
veteran parking placard,1300,Low,"DMV sites, State disability offices",State-by-state parking benefits,State Benefits,90,Accessibility benefit
veteran drivers license,1100,Low,"DMV sites, State sites",Veteran designation on DL guide,State Benefits,91,ID benefit

military resume,27100,Very High,"Resume services, Military.com, Indeed",Free military resume builder tool,Military Resume,55,High volume/competition
military to civilian resume,14800,High,"Resume services, Military.com",Conversion templates by MOS,Military Resume,68,Competitive
veteran resume,12100,High,"Resume services, Military.com, Indeed",ATS-optimized veteran templates,Military Resume,70,High intent
military resume examples,9900,High,"Resume sites, Military.com, Zety",2025 updated examples by branch,Military Resume,72,Template opportunity
military resume template,8100,High,"Word, Google Docs, Resume sites",Free downloadable templates,Military Resume,73,Template competition
translate military experience to resume,4400,Medium,"Resume sites, Military.com",Translation guide with examples,Military Resume,80,How-to opportunity
military resume writing service,3600,Medium,"TopResume, Military.com, Indeed",Service comparison and reviews,Military Resume,82,Commercial intent
how to write military resume,2900,Medium,"Military.com, Career sites",Step-by-step guide with examples,Military Resume,84,Tutorial content
military resume keywords,2400,Medium,"Resume sites, ATS guides",Industry-specific keyword lists,Military Resume,85,SEO + resume optimization
military resume builder,1900,Medium,"Resume.com, Indeed, VA.gov",Free interactive builder tool,Military Resume,87,Tool opportunity

veteran job search,8100,High,"Indeed, Military.com, VA.gov",Veteran-friendly job board,Career Search,72,Competitive
military friendly employers,6600,High,"Military.com, Indeed, GI Jobs",Top employer rankings 2025,Career Search,74,Annual list opportunity
jobs for veterans,5400,High,"Indeed, VA.gov, Military.com",Job matching algorithm tool,Career Search,75,Job board competition
veteran employment,4400,High,"DOL.gov, VA.gov, Military.com",Employment statistics and trends,Career Search,76,Data/stats content
transitioning military job search,2900,Medium,"Military.com, LinkedIn, Indeed",Pre-separation job search guide,Career Search,83,Timing-specific
veteran career fair,2400,Medium,"Military.com, RecruitMilitary",Virtual and in-person fair calendar,Career Search,84,Event listings
federal jobs for veterans,1900,Medium,"USAJOBS.gov, VA.gov",Federal hiring guide for vets,Career Search,86,Government pathway
security clearance jobs,12100,High,"ClearanceJobs.com, Indeed, LinkedIn",Clearance job board and salary data,Career Search,68,Specialized niche
veteran hiring preference,1600,Low,"USAJOBS, DOL.gov, VA.gov",How to claim hiring preference,Career Search,88,Federal jobs focus

gi bill,110000,Very High,"VA.gov, Military.com, University sites",GI Bill comparison calculator,Education Benefits,40,Extremely high volume
post 911 gi bill,49500,Very High,"VA.gov, eBenefits, Military.com",Complete benefits breakdown 2025,Education Benefits,48,Very competitive
gi bill housing allowance,27100,Very High,"VA.gov, Military.com, Student sites",BAH rate calculator by zip code,Education Benefits,52,Calculator opportunity
gi bill eligibility,14800,High,"VA.gov, Military.com",Eligibility checker tool,Education Benefits,65,Tool opportunity
gi bill benefits,12100,High,"VA.gov, Military.com, Universities",2025 benefits comparison,Education Benefits,68,Annual update content
transfer gi bill,8100,High,"VA.gov, Military.com",Transfer process step-by-step,Education Benefits,70,How-to guide
gi bill schools,6600,High,"VA.gov, University sites, Niche.com",Top GI Bill schools rankings,Education Benefits,72,School comparison
vocational rehab,5400,High,"VA.gov, VocRehab sites",VR&E vs GI Bill comparison,Education Benefits,74,Alternative program
military tuition assistance,4400,High,"Military.com, Branch sites, VA.gov",TA vs GI Bill guide,Education Benefits,76,Financial planning
yellow ribbon program,3600,Medium,"VA.gov, University sites",Participating schools database,Education Benefits,80,School selection tool

military career change,2900,Medium,"Military.com, Career sites, Indeed",Mid-career transition guide,Career Change,83,Career change focus
second career after military,1900,Medium,"Military.com, AARP, Career coaches",Career assessment tools,Career Change,86,Life stage content
leaving military after 4 years,1600,Low,"Military.com, Reddit, VA.gov",First-term transition guide,Career Change,88,Contract-specific
leaving military after 10 years,1300,Low,"Military.com, Reddit",Mid-career exit strategy,Career Change,90,Career-specific timing
retiring from military at 20 years,1100,Low,"Military.com, MOAA, VA.gov",Military retirement transition,Career Change,91,Retirement focus
mid career military transition,880,Low,"Military.com, Career coaches",Career pivot strategies,Career Change,93,Underserved segment
military officer transition,950,Low,"Military.com, MOAA, LinkedIn",Officer-specific career guidance,Career Change,92,Leadership transition

military spouse employment,5400,High,"MSEP, Military.com, Indeed",Portable career guide,Military Spouse,75,Spouse-specific
military spouse jobs,4400,High,"MSEP, Indeed, Military.com",Remote job opportunities,Military Spouse,77,Remote work focus
military spouse resume,2900,Medium,"Military.com, Resume sites",Address employment gaps guide,Military Spouse,83,Resume challenges
military spouse career,2400,Medium,"MSEP, Hiring Our Heroes",Career path planning,Military Spouse,84,Long-term planning
portable careers military spouse,1900,Medium,"MSEP, Military.com",Top portable careers list,Military Spouse,86,Career selection
military spouse unemployment,1300,Low,"MSEP, DOL statistics",Resources and support,Military Spouse,90,Support content
military spouse remote work,1100,Low,"FlexJobs, MSEP, Indeed",Remote job strategies,Military Spouse,91,Remote work boom
military spouse license transfer,950,Low,"MSEP, State licensing boards",Interstate license reciprocity,Military Spouse,92,Licensing barrier

veteran mental health,6600,High,"VA.gov, Mental Health America",Mental health resources guide,Healthcare,74,Critical support content
veteran ptsd,5400,High,"VA.gov, PTSD.va.gov, NIMH",PTSD treatment options,Healthcare,76,Mental health focus
veteran suicide prevention,3600,Medium,"VA.gov, Veterans Crisis Line",Crisis resources and support,Healthcare,82,Life-saving content
veteran healthcare,2900,Medium,"VA.gov, VA hospitals",VA healthcare enrollment guide,Healthcare,83,Healthcare access
va health benefits,2400,Medium,"VA.gov, eBenefits",Complete health benefits list,Healthcare,84,Benefits overview
veteran tbi,1900,Medium,"VA.gov, BrainLine.org",TBI resources and treatment,Healthcare,86,Injury-specific
military sexual trauma,1600,Low,"VA.gov, MST resources",MST support and benefits,Healthcare,88,Sensitive topic
veteran rehabilitation,1300,Low,"VA.gov, VocRehab",Physical rehabilitation resources,Healthcare,90,Recovery focus